{
  "schema": "ku2d.phase-package-scope-declaration.v1",
  "declaration_id": "KU2D-SCOPE-000001-P02",
  "declaration_type": "phase",
  "package_id": "KU2D-P-000054",
  "package_name": "TikTok Source Completion",
  "phase_id": "P54-02",
  "phase_name": "deep_audit",
  "parent_declaration_id": "KU2D-SCOPE-000001",
  "human_authority_id": "KU2D-H-000023",
  "domain": {"id": "social.public_short_video", "label": "Social — Public Short Video"},
  "source": {"id": "tiktok", "label": "TikTok", "topics": ["Diving lesson", "Diving equipment"]},
  "capability": ["public_video_metadata", "creator_identity", "public_stable_video_identity", "public_observation_timestamp", "analysis_handoff"],
  "acquisition_technique": {
    "status": "externally_blocked",
    "strategy_ladder": ["Technique Library reuse", "official documented public surface", "public structured data/catalog", "policy-compliant public network surface", "public HTML/browser rendering", "bounded source-specific method"],
    "selected_technique": null,
    "freeze_rule": "No source acquisition technique may be selected while stable topic video identity is externally blocked."
  },
  "authorized_files_or_modules": ["services/data-acquisition/knowledge/v1/tiktok/**", "services/data-acquisition/docs/**", "services/data-acquisition/tools/SELF_TEST_TIKTOK_SOURCE_COMPLETION.py"],
  "explicit_out_of_scope": [".github/workflows/data-acquisition-platform-ci.yml", "services/data-acquisition/acquisition/source_runner.py", "services/data-acquisition/acquisition/connector_kit.py", "services/data-acquisition/acquisition/run_manifest.py", "services/data-acquisition/acquisition/adapter_registry.py", "services/data-acquisition/knowledge/v1/immutable-run-manifest.schema.json", "services/data-acquisition/knowledge/v1/adapter-registry.schema.json", "comments", "captions", "transcripts", "private account data", "follower enrichment", "login, cookies or credentials", "CAPTCHA/anti-bot/policy bypass", "production write", "scheduling", "main branch modification"],
  "validation_profile": ["definition and seven-field scope declaration", "contract/schema validation", "isolated feature branch", "diff and invariant-byte check", "unit and TikTok fixture tests", "source integration and evidence validation", "bounded public live smoke only when necessary", "exact-head full deterministic corpus", "PR approval and CI", "squash merge to integration", "post-merge verification"]
}
